sno,h,sub_h,link
1,Cops rushed 470 Road accident victims to hospitals in PCR vans in 18 months: Data,"At least 470 Road accident victims in the capital were shifted to nearby hospitals by the commissionerate police in the past 18 months, data shared by police shows. A bulk of the victims were sole earning members of their families.",https://timesofindia.indiatimes.com/city/bhubaneswar/cops-rushed-470-road-accident-victims-to-hospitals-in-pcr-vans-in-18-months-data/articleshow/102295968.cms
2,‘Road accident deaths dip in April-May than in 2022’,,https://timesofindia.indiatimes.com/city/bhubaneswar/road-accident-deaths-dip-in-april-may-than-in-2022/articleshow/102243314.cms
3,Road accident deaths went up 17% in 1st 3 months in Odisha,"Odisha witnessed a 17% rise in deaths due to Road accidents between January and March this year as compared to the first quarter in the previous year, according to the latest data compiled by the state police.",https://timesofindia.indiatimes.com/city/bhubaneswar/road-accident-deaths-went-up-17-in-1st-3-months-in-odisha/articleshow/101371230.cms
4,Cops get training to improve road crash probe skills,"Amid a spate of fatal Road accidents in the state, the transport department on Wednesday launched a 20-day training programme for police personnel to enhance their skills to investigate such cases.",https://timesofindia.indiatimes.com/city/bhubaneswar/cops-get-training-to-improve-road-crash-probe-skills/articleshow/101530516.cms
5,"Couple, five-year-old daughter killed in car-tanker collision in Odisha's Koraput","The deceased have been identified as Jeypore natives, Satrughan Pradhan (35), his wife Rasmita (25) and their daughter Subhalaxmi (5), said police.",https://timesofindia.indiatimes.com/city/bhubaneswar/couple-five-year-old-daughter-killed-in-car-tanker-collision-in-odishas-koraput/articleshow/101304020.cms
6,"7 of wedding party killed, 4 injured after their car falls into canal in Odisha's Sambalpur","Seven people were killed and four injured, after their car fell into the Sasan canal at Sasan area in Sambalpur district, while they were returning after attending a marriage function in the wee hours of Friday.",https://timesofindia.indiatimes.com/city/bhubaneswar/7-of-wedding-party-killed-4-injured-after-their-car-falls-into-canal-in-odishas-sambalpur/articleshow/99132419.cms
7,"Two dead, 10 injured in Road accident",,https://timesofindia.indiatimes.com/city/bhubaneswar/two-dead-10-injured-in-road-accident/articleshow/99681844.cms
8,"In Odisha, two dead, 10 injured in Road accident",Two persons died and 10 others were injured after the auto-rickshaw they were travelling in rolled into a 7ft-deep ditch near Manikapur under Gajapati district's R Udayagiri police station on Friday.,https://timesofindia.indiatimes.com/city/bhubaneswar/in-odisha-two-dead-10-injured-in-road-accident/articleshow/99681801.cms
9,Seven from West Bengal killed in Road accident in Odisha,Seven people from West Bengal died when a poultry van they were travelling in rammed into a stationary truck on Saturday morning at Neulipur Chhack on National High way-16 in Odisha's Jajpur district.,https://timesofindia.indiatimes.com/city/bhubaneswar/seven-from-west-bengal-killed-in-road-accident-in-oidhsa/articleshow/98229910.cms
10,"2 killed, 40 injured as tourist bus falls off bridge in Odisha's Dhenkanal",Two persons were killed and 40 others injured after a tourist bus fell off a bridge near Panchabati in Dhenkanal town on national highway-55 early on Monday morning.,https://timesofindia.indiatimes.com/city/bhubaneswar/2-killed-40-injured-as-tourist-bus-falls-off-bridge-in-odishas-dhenkanal/articleshow/97240944.cms
11,"Road accidents high, review safety steps: SC panel to Odisha CM Naveen Patnaik",The Supreme Court Committee on Road Safety has urged chief minister Naveen Patnaik to review the road safety scenario in Odisha in view of an alarming rise in accident fatalities in the state. The SC panel is likely to send some of its officials to the state in the next two weeks to inspect the compliance of its orders.,https://timesofindia.indiatimes.com/city/bhubaneswar/road-accidents-high-review-safety-steps-sc-panel-to-odisha-cm-naveen-patnaik/articleshow/96809035.cms
12,OHRC orders ₹5L to kin of girl killed in accident,"The Odisha Human Rights Commission (OHRC) is asking the state government to pay Rs. 5 lakh compensation to the parents of a plus III student who was run over by a truck in front of Ravenshaw University in September 2019. The commission is also asking the government to ensure better management of traffic, and to take other measures to prevent accidents like this from happening in the future.",https://timesofindia.indiatimes.com/city/bhubaneswar/ohrc-orders-5l-to-kin-of-girl-killed-in-accident/articleshow/96780132.cms
13,Policy to probe fatal Road accidents,"The state government has decided to formulate a policy to conduct forensic investigation into road fatalities. The transport department has prepared a draft memorandum under the banner of Odisha Crash Investigation Policy, 2022 for approval of the government.",https://timesofindia.indiatimes.com/city/bhubaneswar/policy-to-probe-fatal-road-accidents/articleshow/94872116.cms
14,Odisha Road accident death toll rises to 7,"The death toll in the accident on the Sambalpur-Jharsuguda Biju Expressway in Odisha has increased to seven with three more people succumbing to injuries, police said on Saturday.",https://timesofindia.indiatimes.com/city/bhubaneswar/odisha-road-accident-death-toll-rises-to-7/articleshow/94266948.cms
15,Odisha records 48 deaths per 100 Road accidents,"With an alarming 48 deaths per 100 accidents, higher than the national average of 36, Odisha is eyeing massive expansion of its trauma care facilities to reduce fatalities.",https://timesofindia.indiatimes.com/city/bhubaneswar/focus-on-trauma-care-after-rising-accident-fatalities/articleshow/94976956.cms
16,Odisha: Lensman Ashok Panda dies in Road accident,"Senior photo journalist Ashok Panda died in a Road accident on Friday morning, when he was on his way to Puri to cover the Rath Yatra.",https://timesofindia.indiatimes.com/city/bhubaneswar/lensman-ashok-panda-dies-in-road-accident/articleshow/92607855.cms
17,"Four killed, 11 injured in two Road accidents in Odisha","Four persons were killed and 11 others injured in two separate Road accidents in Odisha's Subarnapur and Khurda districts on Tuesday, police said.",https://timesofindia.indiatimes.com/city/bhubaneswar/four-killed-11-injured-in-two-road-accidents-in-odisha/articleshow/92828903.cms
18,Road accident deaths up by 7% in first 5 months of 2022,"Deaths due to Road accidents increased by 7% from January to May this year compared to the corresponding period last year, prompting the transport department to seek a report from transport commissioner Arun Bothra on the reasons behind the rise in road fatalities.",https://timesofindia.indiatimes.com/city/bhubaneswar/road-accident-deaths-up-by-7-in-first-5-months-of-2022/articleshow/93062935.cms
19,Road accident fatalities rose by 12% in 2021: Data,Deaths due to Road accidents increased by 12% across the state from January-October in 2021 as against the corresponding 10 months in 2020.,https://timesofindia.indiatimes.com/city/bhubaneswar/road-accident-fatalities-rose-by-12-in-2021-data/articleshow/89127011.cms
20,Death in Road accidents went up by 7.2% last year,"Fatality rate in Road accidents in Odisha increased by 7.24% in 2021 as compared to 2020. According to the statistics shared by the state police with the transport department, 5,081 people died in road mishaps last year as against 4,738 in 2020.",https://timesofindia.indiatimes.com/city/bhubaneswar/death-in-road-accidents-went-up-by-7-2-last-year/articleshow/90579728.cms
21,Road accident deaths in Odisha increase by 8.87% in first quarter,Deaths due to Road accidents in Odisha increased by 8.87% in the first quarter of 2021 as compared to the corresponding period in 2020.,https://timesofindia.indiatimes.com/city/bhubaneswar/road-accident-deaths-in-odisha-increase-by-8-87-in-first-quarter/articleshow/84074820.cms
22,"Speed up disposal of Road accident insurance claims, govt tells cops",The state government has asked police to expedite the disposal of cases related to insurance claims made by victims of Road accidents.,https://timesofindia.indiatimes.com/city/bhubaneswar/speed-up-disposal-of-road-accident-insurance-claims-govt-tells-cops/articleshow/90004063.cms
23,"Odisha to train 30,000 as first responders to Road accidents","Chief minister Naveen Patnaik on Wednesday launched a road safety initiative here called Rakshak - a first responders' training programme. Under this initiative, at least 30,000 volunteers, staying or working at eateries and different business establishments located near accident-prone spots, will be trained as first responders to s.",https://timesofindia.indiatimes.com/city/bhubaneswar/odisha-to-train-30000-as-first-responders-to-road-accidents/articleshow/87644376.cms
24,"Odisha: 9 dead, 13 injured after van overturns in Koratpur",Nine people lost their lives on Sunday and 13 suffered injuries after a van overturned in Kotpad of Odisha's Koraput district.,https://timesofindia.indiatimes.com/city/bhubaneswar/odisha-9-dead-13-injured-after-van-overturns-in-koratpur/articleshow/80621291.cms
25,Odisha govt stresses on joint inspection of Road accident spots,,https://timesofindia.indiatimes.com/city/bhubaneswar/odisha-govt-stresses-on-joint-inspection-of-road-accident-spots/articleshow/84866903.cms
26,Odisha records 11% fall in Road accident deaths in 2020,"Fatality rate in Road accidents in Odisha dropped by nearly 11% in 2020 as compared to 2019. According to the statistics of the state police, 4738 persons were killed in road mishaps in the state last year as against 5333 deaths in 2019.",https://timesofindia.indiatimes.com/city/bhubaneswar/odisha-records-11-fall-in-road-accident-deaths-in-2020/articleshow/80755046.cms
27,District monitoring committees to analyse Road accidents in Odisha,The state government has decided to constitute expert committees in each district to analyse causes of Road accidents and suggest remedial measures to minimize such mishaps. Additional district magistrate (ADM) will head the committee in districts.,https://timesofindia.indiatimes.com/city/bhubaneswar/district-monitoring-committees-to-analyse-road-accidents-in-odisha/articleshow/76792756.cms
28,Odisha IAS officer saves life of Road accident victim on lockdown evening,,https://timesofindia.indiatimes.com/city/bhubaneswar/odisha-ias-officer-saves-life-of-road-accident-victim-on-lockdown-evening/articleshow/82805213.cms
29,"Road accidents due to drink driving go up, but checking",,https://timesofindia.indiatimes.com/city/bhubaneswar/road-accidents-due-to-drink-driving-go-up-but-checking/articleshow/78025591.cms
30,Odisha govt seeks report from collectors on rising Road accident deaths,The state government has expressed strong displeasure over the rise in Road accident deaths and sought explanations from district collectors within fifteen days. The government also came down heavily on the police and regional transport officers (RTOs) for poor enforcement drives against the traffic violators.,https://timesofindia.indiatimes.com/city/bhubaneswar/odisha-govt-seeks-report-from-collectors-on-rising-road-accident-deaths/articleshow/79945870.cms
31,Seven killed in Road accidents in Odisha,"At least seven people, including a woman, were killed and as many seriously injured in separate Road accidents in Kendrapara, Ganjam, Balasore and Rayagada districts of Odisha since Wednesday, police said.",https://timesofindia.indiatimes.com/city/bhubaneswar/seven-killed-in-road-accidents-in-odisha/articleshow/73067572.cms
32,Road accident deaths go down in Odisha,"Number of deaths due to road mishaps reduced in October this year compared to the figures of last year by 18.69 per cent. Similarly, state witnessed 11.9 per cent less Road accident deaths in September this year against last September. Authorities attributed it to better implementation of traffic norms.",https://timesofindia.indiatimes.com/city/bhubaneswar/road-accident-deaths-go-down-in-odisha/articleshow/72874312.cms
33,"10 drown, 3 killed in Road accident after Holi celebrations in Odisha","At least 10 people drowned while bathing and three were killed in a Road accident after Holi celebrations in Odisha on Tuesday, police said.",https://timesofindia.indiatimes.com/city/bhubaneswar/10-drown-3-killed-in-road-accident-after-holi-celebrations-in-odisha/articleshow/74566137.cms
34,5 of family die in Kalahandi mishap,"Five members of a family were killed and two others seriously injured when the car in which they were travelling collided with a truck in Odisha's Kalahandi district early on Wednesday, police said.",https://timesofindia.indiatimes.com/city/bhubaneswar/five-killed-two-injured-in-road-accident-in-odisha/articleshow/69440921.cms
35,Kendrapada: Couple killed in Road accident,"The couple was riding pillion.While Ganesh Das (57) of Deriki village died on the spot, his wife Lata Das (55) succumbed to her injuries on her way to SCB medical college and hospital in Cuttack.",https://timesofindia.indiatimes.com/city/bhubaneswar/kendrapada-couple-killed-in-road-accident/articleshow/68736267.cms
36,Road accident deaths worry Odisha government,,https://timesofindia.indiatimes.com/city/bhubaneswar/road-accident-deaths-worry-odisha-government/articleshow/70142872.cms
