sno,h,sub_h,link
75,Supreme Court panel not impressed with Punjab’s efforts to curb Road accident fatalities,The Supreme Court committee on road safety has expressed displeasure over Punjab government’s failure to curb the raising trend of fatalities due to Road accidents and set a target of bringing down the number by 10%. The observation made by the committee was discussed in a meeting of the Punjab state road safety council held on December 24. State transport minister Razia Sultana emphasised the need to speed up the road safety measures to reduce fatal accidents.,https://timesofindia.indiatimes.com/city/chandigarh/supreme-court-panel-not-impressed-with-punjabs-efforts-to-curb-road-accident-fatalities/articleshow/72976968.cms
76,"Chandigarh: 30 pedestrians, 10 cyclists killed in accidents this year","Out of 92 people killed in Road accidents in the city from January 1 to December 16, as many as 30 were pedestrians and 10 were cyclists, according to the records of the UT police.",https://timesofindia.indiatimes.com/city/chandigarh/chandigarh-30-pedestrians-10-cyclists-killed-in-accidents-this-year/articleshow/72933018.cms
77,"Chandigarh: Cyclist killed in Sector 20, 3 hurt in car crash near mall",Accidents claimed the life of a 58-year-old cyclist and left three occupants of a car injured on Friday.,https://timesofindia.indiatimes.com/city/chandigarh/chandigarh-cyclist-killed-in-sector-20-3-hurt-in-car-crash-near-mall/articleshow/72314444.cms
78,Zomato loses fourth boy to crash in seven months,"Zomato has lost its fourth food delivery boy to a Road accident in seven months. Sunny, 23, died in a hit-and-run on the dividing road of sectors 12-A and 14 in the wee hours of Thursday.",https://timesofindia.indiatimes.com/city/chandigarh/zomato-loses-fourth-boy-to-crash-in-7-months/articleshow/72175284.cms
79,2018 accidents: Casualties below 100 for 1st time in six years in Chandigarh,"The number of casualties in Road accidents in Chandigarh in 2018 has come down to 98, which is the lowest since 2013, the data released by the ministry of road transport and highway transport research wing, New Delhi, has revealed.",https://timesofindia.indiatimes.com/city/chandigarh/2018-accidents-casualties-below-100-for-1st-time-in-six-years-in-chandigarh/articleshow/72091922.cms
