sno,h,sub_h,link
1,45-year-old woman dies in accident on Ara-Arwal Road,A 45-year-old woman died in a Road accident near Jamuni Tola on the Ara-Arwal Road when she was going to relieve herself in the field on Monday morning.,https://timesofindia.indiatimes.com/city/patna/45-year-old-woman-dies-in-accident-on-ara-arwal-road/articleshow/102295654.cms
2,5 of a wedding party die in Road accident,Five members of a wedding party died on the spot and nine others were injured when the car in which they were travelling rammed into a stationary truck on a highway near Maranga police station in Purnia district on Saturday.,https://timesofindia.indiatimes.com/city/patna/5-of-a-wedding-party-die-in-road-accident/articleshow/100735667.cms
3,3 of family die in Road accident,,https://timesofindia.indiatimes.com/city/patna/3-of-family-die-in-road-accident/articleshow/100952450.cms
4,Three die in Road accident in Samastipur,Three persons died and three others were severely injured while returning from a wedding procession under Singhia police station area in Samastipur district Saturday night.,https://timesofindia.indiatimes.com/city/patna/three-die-in-road-accident-in-samastipur/articleshow/100926018.cms
5,"1 dead, ASP among four injured in Road accident in Patna","A 20-year-old youth died on the spot while four policemen, including Paliganj ASP Awadhesh Saroj Dixit, were injured in a major accident on the highway connecting Bikram to Paliganj, in Patna district on Saturday. The accident took place around 11:30am when Dixit along with other cops was travelling in his official vehicle. The deceased was identified as Vimlesh Kumar of Faridpur village under Naubatpur police station area.",https://timesofindia.indiatimes.com/city/patna/1-dead-asp-among-four-injured-in-road-accident-in-patna/articleshow/101248759.cms
6,42% of Road accidents in state took place on nat'l highways last yr: ADG,ADG (headquarters) JS Gangwar on Monday said that 42.6% of the total Road accidents took place alone on national highways in 2022.,https://timesofindia.indiatimes.com/city/patna/42-of-road-accidents-in-state-took-place-on-natl-highways-last-yr-adg/articleshow/100262246.cms
7,"Five of a wedding party dead, 9 injured after car rams into truck near Bihar's Purnia",Five members of a wedding party died on the spot and nine others injured when a car in which they were travelling rammed into a stationary truck on a highway near Maranga police station in Purnia district on Saturday.,https://timesofindia.indiatimes.com/city/patna/five-of-wedding-party-dead-9-injured-after-car-ramms-into-truck-near-bihars-purnia/articleshow/100732053.cms
8,Bihar: Five die in Arwal Road accident,"Five persons died on the spot while several others sustained injuries in a Road accident near Khokhri village in Arwal district Friday night. The deceased were travelling in an autorickshaw, which collided head-on with a truck near the Khokhri Mor.",https://timesofindia.indiatimes.com/city/patna/bihar-five-die-in-arwal-road-accident/articleshow/100023905.cms
9,Good Samaritans feted for helping accident victims,"District magistrate (DM) Chandrashekhar Singh on Thursday honoured 12 Good Samaritans for rushing the victims of Road accidents to hospitals in ‘golden hour’ and saving their precious lives. They were awarded with Rs 5000 cash, a citation and a shawl each.",https://timesofindia.indiatimes.com/city/patna/good-samaritans-feted-for-helping-accident-victims/articleshow/100516375.cms
10,"4 people, 150 sheep killed in accident involving two trucks in Maharashtra's Hingoli district","Four people and 150 sheep were killed after a truck carrying the animals hit another truck in Maharashtra's Hingoli district early on Thursday, a police officer said. The accident took place at Malegaon phata on Nanded-Kalamnuri road at around 4am, he said, adding that traffic movement on the route was disrupted for some time.",https://timesofindia.indiatimes.com/city/aurangabad/4-people-150-sheep-killed-in-accident-involving-two-trucks-in-maharashtras-hingoli-district/articleshow/100501873.cms
11,"12% jump in Road accidents, fatalities up by 16% in Bihar",Fatalities due to Road accidents in the state started showing upward trend after a decline in 2020 because of travel restrictions owing to Covid-19 pandemic.,https://timesofindia.indiatimes.com/city/patna/12-jump-in-road-accidents-fatalities-up-by-16-in-bihar/articleshow/98643972.cms
12,"Road accidents claim 15 lives in Bihar in 48 hours, many hurt","At least 15 people were killed and several others injured in separate Road accidents in Vaishali, Jamui, Saharsa, Purnia, Araria, Munger and Kishanganj districts in the last 48 hours.",https://timesofindia.indiatimes.com/city/patna/road-accidents-claim-15-lives-in-bihar-in-48-hours-many-hurt/articleshow/98529114.cms
13,"5 dead, 8 injured in truck-auto collision in Maharashtra's Nanded district","Five persons were killed and eight were injured in a collision between a truck and an autorickshaw in Maharashtra's Nanded district on Thursday, an official said.",https://timesofindia.indiatimes.com/city/aurangabad/5-dead-8-injured-in-truck-auto-collision-in-maharashtras-nanded-district/articleshow/99123078.cms
14,4 of a family among five dead in Road accident in Bihar's Vaishali,"Five persons, including four members of a family, died after their car collided with a truck near Chikanota on NH-28 (Tajpur-Muzaffarpur road) in Vaishali district on Saturday.",https://timesofindia.indiatimes.com/city/patna/4-of-a-family-among-five-dead-in-road-accident-in-bihars-vaishali/articleshow/100043859.cms
15,"Man, wife & daughter killed as truck rams into auto on Ara-Patna road","A 38-year-old man, his wife and their daughter died, while their three children sustained injuries in a Road accident on the Ara-Patna road on Friday afternoon. The incident occurred when a speeding truck coming from the opposite direction rammed into the auto rickshaw they were travelling in near the under construction Kulhariya Toll Plaza under Koilwar police station of the Bhojpur district.",https://timesofindia.indiatimes.com/city/patna/man-wife-daughter-killed-as-truck-rams-into-auto-on-ara-patna-road/articleshow/97812074.cms
16,"Two dead, 11 hurt in Jamui Road accident","Two persons, including a two-year-old girl, died and 11 others sustained injuries when the autorickshaw they were travelling in collided head-on with a speeding truck on the Jamui-Lakhisarai Road in Jamui district on Sunday morning. The incident took place around 5am near Amba village under Town police station area, police said. The deceased were identified as Jaddu Rajak (30), the autorickshaw driver, a resident of Tilakpur village and Nisha Kumari (2), daughter of Rajkumar Yadav.",https://timesofindia.indiatimes.com/city/patna/two-dead-11-hurt-injamui-road-accident/articleshow/98593832.cms
17,2 dead in Road accident in Patna,A driver of a pick-up van and his helper died when their vehicle collided head on with a school van on Bailey Road flyover in Patna on Friday morning.,https://timesofindia.indiatimes.com/city/patna/2-dead-in-road-accident-in-patna/articleshow/97170569.cms
18,"Minor boy, his father die in B’pur accident",,https://timesofindia.indiatimes.com/city/patna/minor-boy-his-father-die-in-bpur-accident/articleshow/98620291.cms
19,"2 killed, 2 injured as SUV runs over them in Patna",As many as two persons were killed while two others suffered injuries after a speeding SUV ran over many pedestrians on the Bihta-Ara National Highway-30 in Patna.,https://timesofindia.indiatimes.com/city/patna/2-killed-2-injured-as-suv-runs-over-them-in-patna/articleshow/97338144.cms
20,"4 dead, 2 injured in Gopalganj accident",,https://timesofindia.indiatimes.com/city/patna/4-dead-2-injured-in-gopalganj-accident/articleshow/97814011.cms
21,"Maharashtra registers 24,000 Road accidents till September this year, 11,000 dead","Maharashtra registered 24,360 Road accidents in the nine months from January to September this year, a marked rise of 3,127 accidents over the corresponding period last year.",https://timesofindia.indiatimes.com/city/aurangabad/maharashtra-registers-24000-road-accidents-till-september-this-year-11000-dead/articleshow/95725198.cms
22,"Vaishali Road accident: Truck driver was intoxicated, cops say","The police on Monday confirmed that the truck driver Lalu Kumar, who ran over his vehicle on 15 people in Vaishali district and killed eight, was driving under the influence of alcohol. The accused has been arrested in an injured condition and admitted to the Sadar Hospital for treatment.",https://timesofindia.indiatimes.com/city/patna/vaishali-road-accident-truck-driver-was-intoxicated-cops-say/articleshow/95668010.cms
23,"4 die, 2 injured in Gopalganj Road accident in Bihar",Four persons died on the spot while two others sustained injuries in a Road accident under Shripur Thana outpost in Gopalganj district on Thursday night.,https://timesofindia.indiatimes.com/city/patna/4-die-2-injured-in-gopalganj-road-accident-in-bihar/articleshow/97812149.cms
24,"Bihar: 2 die, 1 injured in Gopalganj Road accident",Two persons were killed after their car rammed into the boundary wall of a private school on the Hathua-Mirganj main road under Hathua police station area in Gopalganj district around 3.30am on Sunday.,https://timesofindia.indiatimes.com/city/patna/2-die-1-injured-in-bihars-gopalganj-road-accident/articleshow/95647213.cms
25,Youth and minor girl from Delhi killed in accident on Maharashtra's Samruddhi,"A 19-year-old youth and 14-year-old girl from Delhi were killed in a suspected Road accident on the Samruddhi Super Expressway. The deceased youth has been identified as Aseem alias Buchan Abbas of JJ Colony, Delhi. The fatal accident took place on Tuesday evening near the Sawangi Bridge, and the area falls within the jurisdiction of the Phulambri Police Station of Aurangabad Rural. On learning about the accident, police teams went to the spot and shifted the bodies to the Government Medical College and Hospital. The teens' families were informed of the accident, but due to the delay in their arrival to claim the bodies, the police got the bodies shifted to Mortuary-Based Cold Storage. Police said they are in touch with their Delhi counterparts to check if any missing complaints or a case of kidnapping had been registered with them. Sub-Inspector Damodar Waghmare, who is the investigation officer, said the police are also trying to ascertain if the two Delhi teens were trying to cross the Super Expressway when they were run over by a speeding goods truck or did they take any extreme step. A truck bearing a Tamil Nadu registration number has been seized and a case has been registered against its",https://timesofindia.indiatimes.com/city/aurangabad/youth-and-minor-girl-from-delhi-killed-in-accident-on-samruddhi/articleshow/97158440.cms
26,"6,626 killed in Road accidents last year in Bihar, most victims youth","In 2022, 6626 people died in Road accidents in Bihar. In 2021, 5476 people got injured in Road accidents, and 7660 people were killed in Road accidents. In 2020, 8639 people were killed in Road accidents. State transport commissioner Seema Tripathi said that the majority of victims are in the young age group, especially college students who drive vehicles carelessly or overtake other vehicles or speeding. ""During the road safety week from January 11 to 17, awareness drive will be held in all districts of Bihar through radio jingles, nukad natak' and short movies to sensitise commuters to drive safely by following motor vehicles act,"" she said. ""The department is also taking measures to curb s by identifying not only the black spots but also the vulnerable points black spots are such areas where 10 accidents and 10 deaths took place within a year and the vulnerable points are those where more than three persons died and less than 10 accidents took place within a year. With the help of the nhai road construction department and rural works department, we are trying to identify the problems in such black spots and vulnerable points across the state. Measures like speed breakers, rumble strips, signage, zebra crossing and street lights are being taken as per",https://timesofindia.indiatimes.com/city/patna/6626-killed-in-road-accidents-last-year-in-state-most-victims-youth/articleshow/96926794.cms
27,"6,626 killed and 5,476 injured in Road accidents across state last yr","In 2022, 6626 people died in Road accidents in Bihar. In 2021, 5476 people got injured in Road accidents, and 7660 people were killed in Road accidents. In 2020, 8639 people were killed in Road accidents. State transport commissioner Seema Tripathi said that the majority of victims are in the young age group, especially college students who drive vehicles carelessly or overtake other vehicles or speeding. ""During the road safety week from January 11 to 17, awareness drive will be held in all districts of Bihar through radio jingles, nukad natak' and short movies to sensitise commuters to drive safely by following motor vehicles act,"" she said. ""The department is also taking measures to curb s by identifying not only the black spots but also the vulnerable points black spots are such areas where 10 accidents and 10 deaths took place within a year and the vulnerable points are those where more than three persons died and less than 10 accidents took place within a year. With the help of the nhai road construction department and rural works department, we are trying to identify the problems in such black spots and vulnerable points across the state. Measures like speed breakers, rumble strips, signage, zebra crossing and street lights are being taken as per",https://timesofindia.indiatimes.com/city/patna/6626-killed-and-5476-injured-in-road-accidents-across-state-last-yr/articleshow/96926774.cms
28,"Vaishali accident: Truck driver was drunk, say police","The police on Monday confirmed that the truck driver Lalu Kumar, whose vehicle ran over at least eight persons and injured several others in Vaishali Sunday night, was drunk. He was arrested in an injured and inebriated condition and admitted to the Sadar Hospital for treatment.",https://timesofindia.indiatimes.com/city/patna/vaishali-accident-truck-driver-was-drunk-says-sp/articleshow/95673784.cms
29,Woman dies in Road accident,"A 55-year-old woman, Sushila Devi, was killed and her husband, Ramashray Yadav, got injured when a speeding bus hit their two-wheeler near Sanhauli fuel station under the Naubatpur police station area in Patha on Sunday.",https://timesofindia.indiatimes.com/city/patna/woman-dies-in-road-accident/articleshow/93419249.cms
30,"2 killed, 20 injured as bus rams into truck in Bihar's Vaishali",At least two persons were killed and 20 others injured after a bus they were travelling in rammed into a stationary truck in Bihar's Vaishali district.,https://timesofindia.indiatimes.com/city/patna/2-killed-20-injured-as-bus-rams-into-truck-in-bihars-vaishali/articleshow/95118210.cms
31,Bihar: 7 die in separate Road accidents in Begusarai,"Seven people, including a woman, were killed in separate Road accidents under various police stations of Begusarai district on Wednesday.",https://timesofindia.indiatimes.com/city/patna/bihar-7-die-in-separate-road-accidents-in-begusarai/articleshow/94692024.cms
32,Six killed in Road accident in Maharashtra's Beed,"Six people were killed after a car and a tempo collided head-on in Maharashtra's Beed district on Sunday morning, police said. The accident took place around 5.30am on Manjarsumba-Patoda highway, they said.",https://timesofindia.indiatimes.com/city/aurangabad/six-killed-in-road-accident-in-maharashtras-beed/articleshow/93552834.cms
33,Patna: Woman dies in Road accident,"A 55-year-old woman, Sushila Devi, was killed and her husband, Ramashray Yadav, got injured when a speeding bus hit their two-wheeler near Sanhauli fuel station under the Naubatpur police station area in Patha on Sunday.",https://timesofindia.indiatimes.com/city/patna/patna-woman-dies-in-road-accident/articleshow/93419403.cms
34,Bihar: Three killed in Road accidents in Begusarai,"Three persons, including a shopkeeper, died in separate Road accidents under Bachhwara police station area of Begusarai district on Saturday night.",https://timesofindia.indiatimes.com/city/patna/bihar-three-killed-in-road-accidents-in-begusarai/articleshow/93098561.cms
35,"5 killed, 7 hurt in Vaishali Road accident",At least five people were killed and seven others injured when a speeding truck rammed into a roadside eatery in Vaishali district on Wednesday. The incident occurred around 1.30pm near Bahuara Chowk on state highway-49 under the Patepur police station area in the district.,https://timesofindia.indiatimes.com/city/patna/5-killed-7-hurt-in-vaishali-road-accident/articleshow/93335925.cms
36,Bihar records over 7% decline in Road accidents,The number of Road accidents in the first three months of the year (January to March) has declined by 7.73% in the state when compared to the same period in 2021. The number of road fatalities also came down by 2.,https://timesofindia.indiatimes.com/city/patna/state-records-over-7-decline-in-road-accidents/articleshow/91358507.cms
37,"Ensure quick medical care to Road accident victims, min tells officials","State transport minister Sheela Kumari on Thursday instructed the officers concerned to ensure that the Road accident victims get immediate medical care during the “golden hour”, the first 60 minutes following an injury.",https://timesofindia.indiatimes.com/city/patna/ensure-quick-medical-care-to-road-accident-victims-min-tells-officials/articleshow/94547568.cms
38,"Ensure quick medical care to Road accident victims, says minister Sheela Kumari","State transport minister Sheela Kumari on Thursday instructed the officers concerned to ensure that the Road accident victims get immediate medical care during the “golden hour” period, the first 60 minutes following an injury.",https://timesofindia.indiatimes.com/city/patna/ensure-quick-medical-care-to-road-accident-victims-says-minister-sheela-kumari/articleshow/94547583.cms
39,Siwan boy lynched after Road accident,"A 16-year-old boy was lynched and his fawas seriously injured by the mob after their SUV hit a band group in Sevatapur Mouja village under Mairwa police station in Siwan district on Sunday. After the collision, a scuffle was broke out between Sunil Manjhi and member of the band group.",https://timesofindia.indiatimes.com/city/patna/siwan-boy-lynched-after-road-accident/articleshow/91879612.cms
40,"Five killed in Road accident in Bhagalpur, seven injured",Five people were killed and seven other got injured when a auto-rickshaw carrying a wedding party collided head on with a truck on the NH-31 in Naugachia in Bhagalpur district of Bihar on the intervening night of Monday and Tuesday.,https://timesofindia.indiatimes.com/city/patna/five-killed-as-truck-rams-into-auto-rickshaw-in-bihars-bhagalpur/articleshow/92207144.cms
41,Bihar: 4 killed in Road accident in Valmikinagar tiger reserve,Four people of a family were killed and as many critically injured after a car rammed into a tree in Valmikinagar Tiger Reserve in Bihar's West Champaran district.,https://timesofindia.indiatimes.com/city/patna/bihar-4-killed-in-road-accident-in-valmikinagar-tiger-reserve/articleshow/91611029.cms
42,"Bihar: Six die in Madhepura, Gaya Road accidents",Altogether six people were killed in two separate Road accidents in Madhepura and Gaya districts in last 24 hours.,https://timesofindia.indiatimes.com/city/patna/six-die-in-madhepura-gaya-road-accidents/articleshow/91040406.cms
43,Three women among six die in Road accident in Bihar's Kaimur,"Six persons, including three women, died while three others were critically injured after their e-rickshaw collided with a truck on NH-219 near Amwaman under Chaipur police station area in Kaimur district late Sunday evening.",https://timesofindia.indiatimes.com/city/patna/three-women-among-six-die-in-road-accident-in-bihars-kaimur/articleshow/92169020.cms
44,10-year-old among 7 killed in Road accident,"Seven people were killed on the spot in an accident caused by the head-on collision of a speeding four-wheeler (a Cruiser) and a truck in Ambajogai of Beed district. Of the seven deceased, six belonged to the same family.The accident took place around 10.",https://timesofindia.indiatimes.com/city/aurangabad/10-year-old-among-7-killed-in-road-accident/articleshow/91040701.cms
45,Four of a family killed in Road accident,"Four members of a family, including two women, were killed in an accident that took place on the Solapur-Dhule National Highway on Friday morning after the car they were travelling in rammed into a trailer carrying tractors.",https://timesofindia.indiatimes.com/city/aurangabad/four-of-a-family-killed-in-road-accident/articleshow/88625847.cms
46,13% decline in Road accidents in Bihar: Government,State transport minister Sheela Kumari on Thursday said road safety was a sensitive issue and all the departments should make efforts together to reduce the Road accidents.,https://timesofindia.indiatimes.com/city/patna/13-decline-in-road-accidents-in-state-govt/articleshow/88460292.cms
47,Workers from Bihar killed in Nagaland Road accident had left to eke out a living,Bihar CM Nitish Kumar on Sunday announced an ex gratia payment of Rs 2 lakh each to the next kin of four construction workers of Katihar’s Korha block who were killed in a Road accident in Nagaland’s Chumoukedima district on Saturday.,https://timesofindia.indiatimes.com/city/patna/workers-from-bihar-killed-in-nagaland-road-accident-had-left-to-eke-out-a-living/articleshow/92638403.cms
48,"Bihar: Five dead, 10 hurt in Buxar Road accident",At least five persons died and ten were critically injured in a head-on collision between a Scorpio and a bus near Kritsagar village under Krishna Brahma police station area in Buxar district on Saturday evening.,https://timesofindia.indiatimes.com/city/patna/five-dead-10-hurt-in-buxar-road-accident/articleshow/89694629.cms
49,Bihar CM Nitish Kumar announces ex-gratia of Rs 2 lakh to kin of 8 people killed in Road accident near Barabanki,"Both the ill-fated buses, which originated from Bihar’s Sitamarhi and Supaul (Darbhanga) towns, were on their way to the national capital. All eight deceased and 18 injured persons hail from Bihar.",https://timesofindia.indiatimes.com/city/patna/bihar-cm-nitish-kumar-announces-ex-gratia-of-rs-2-lakh-to-kin-of-8-people-killed-in-road-accident-near-barabanki/articleshow/93116639.cms
50,"Two killed, one injured in Road accident in Beed","Two persons were killed and one injured when their car hit a divider on Dhule-Solapur Highway in Maharashtra's Beed district, police said on Saturday.",https://timesofindia.indiatimes.com/city/aurangabad/two-killed-one-injured-in-road-accident-in-beed/articleshow/86504794.cms
51,"Two die, 4 injured in Patna as car runs over them",Two persons died and four more were critically injured after a car ran over them on NH-30 service lane near Sorangpur under Ramkrishna Nagar police station area in Patna at around 5.45am on Tuesday. The car was coming from Dhanbad in Jharkhand and was going to Saguna Mor in Danapur.,https://timesofindia.indiatimes.com/city/patna/two-die-4-injured-in-accident/articleshow/86592452.cms
52,"Woman robbed in Patna, girl dies in Road accident",,https://timesofindia.indiatimes.com/city/patna/woman-robbed-in-patna-girl-dies-in-road-accident/articleshow/85909032.cms
53,"8% fall in Road accidents in Bihar, but 0.3% rise in fatalities","The Road accident cases in the state declined by 8.68% but the fatalities increased by 0.3% in the first six months of 2021, as compared to the period in 2019. The state transport department figures also revealed around 10% rise in the number of people getting injured in 2021, compared to 2019. The figures of 2020 were not taken into account because of complete lockdown from March 23 till Unlock 1.0 in May.",https://timesofindia.indiatimes.com/city/patna/8-fall-in-road-accidents-but-0-3-rise-in-fatalities/articleshow/86490967.cms
54,"Bihar: Six of family killed in Katihar Road accident; PM Modi, CM express grief","Six members of a family were killed when their car rammed into a truck on a highway in Bihar's Katihar district on Tuesday, police said. The mishap took place on NH-31 in the Kursela Police Station area when the deceased were returning to their home in Samastipur from Purnea where they had gone to finalise a marriage, SHO Aman Raj said.",https://timesofindia.indiatimes.com/city/patna/six-of-family-killed-in-bihar-road-accident-pm-modi-cm-express-grief/articleshow/81169450.cms
55,Bihar: Two doctors among 7 killed in Gaya,Seven people – two doctors and five staff members of a paediatric hospital here – were killed on Friday when their car collided head on with a truck on Dobhi-Chatra highway.,https://timesofindia.indiatimes.com/city/patna/two-docs-among-7-killed-in-gaya/articleshow/84691388.cms
56,3 killed in Road accident in Bihar's Bettiah town,"Three persons, believed to be from the same family were mowed down by a tanker in West Champaran district on Monday. The visibility in the area was low due to heavy fog and the driver is said to have been drunk.",https://timesofindia.indiatimes.com/city/patna/3-killed-in-road-accident-in-bihars-bettiah-town/articleshow/79838640.cms
57,Woman and son killed in Road accident in Bihar's Rohtas,"A 35-year-old woman and her five-year-old son were crushed to death by a speeding vehicle in Bihar's Rohtas district on Saturday, police said.",https://timesofindia.indiatimes.com/city/patna/woman-and-son-killed-in-road-accident-in-bihars-rohtas/articleshow/79815050.cms
