sno,h,sub_h,link
58,"Crime, Road accidents down after liquor prohibition: Bihar CM Nitish Kumar","Strongly defending liquor ban a day before his high-level review meeting on the issue in the wake of a series of hooch tragedies recently, CM Nitish Kumar on Monday said the crime rate and number of Road accidents have come down in the state after enforcement of total prohibition.",https://timesofindia.indiatimes.com/city/patna/crime-road-accidents-down-after-liquor-prohibition-cm/articleshow/87724255.cms
59,Maharashtra: 9 injured in Road accident in Latur,"Nine people were injured in an accident involving three vehicles in Maharashtra's Latur district, police said on Tuesday. The accident took place around Monday midnight near Hadolati village in Ahmedpur tehsil when a jeep driver apparently lost control over the wheels.",https://timesofindia.indiatimes.com/city/aurangabad/maharashtra-9-injured-in-road-accident-in-latur/articleshow/81407697.cms
60,"Bihar: 6 killed, 7 injured in separate Road accidents","In the first incident, a daily wager Sukhdev Chauhan (65) and Bahadur Kumar (25) were killed after a truck rammed head on the van in which they were travelling on NH-31 under Mufassil police station area in Nawada at around 6am on Saturday.",https://timesofindia.indiatimes.com/city/patna/bihar-6-killed-7-injured-in-separate-road-accidents/articleshow/83068783.cms
61,6 die in separate Road accidents,,https://timesofindia.indiatimes.com/city/patna/6-die-in-separate-road-accidents/articleshow/79480119.cms
62,Bihar: 3 of a family die in Road accident,"A transporter, his wife and their minor daughter died as the SUV in which they were travelling fell into a roadside field after overturning several times on NH-30 near Saidpur village under Salimpur police station area of rural Patna Friday morning.",https://timesofindia.indiatimes.com/city/patna/3-of-a-family-die-in-road-accident/articleshow/81877269.cms
63,"Covid patient flees Jalna hospital, dies in Road accident",,https://timesofindia.indiatimes.com/city/aurangabad/covid-patient-flees-jalna-hospital-dies-in-road-accident/articleshow/82393834.cms
64,Bihar: Home guard jawan dies in Road accident,A home guard jawan on night patrolling was crushed to death by a speeding pickup van on SH-90 near Dak Bungalow under the Baikunthpur police station area in Gopalganj in the wee hours of Tuesday.,https://timesofindia.indiatimes.com/city/patna/home-guard-jawan-dies-in-road-accident/articleshow/81298063.cms
65,Five killed in Road accident in Bihar's Begusarai,"Five persons were killed after their car hit a road divider and overturned, and a truck rammed into it in Bihar's Begusarai district, police said on Sunday. The accident took place on the National Highway-31 near Lakho village in the Maffosil police station area on Saturday evening, they said.",https://timesofindia.indiatimes.com/city/patna/five-killed-in-road-accident-in-bihars-begusarai/articleshow/77181721.cms
66,Five of a band party die in Katihar Road accident,Five persons were killed and 5 others sustained grievous injuries when an autorickshaw collided head-on with a sand-laden truck on the national highway 31 near Sameli primary health centre at Kurshela in the district in the wee hours of Monday.,https://timesofindia.indiatimes.com/city/patna/5-of-a-band-party-die-in-katihar-road-accident/articleshow/81158921.cms
67,"Bihar: Man along with wife, daughter killed in Road accident in Salimpur",,https://timesofindia.indiatimes.com/city/patna/bihar-man-along-with-wife-daughter-killed-in-road-accident-in-salimpur/articleshow/81872469.cms
68,"Bihar: Nine killed, two injured in Road accident in Gaya","Nine persons were killed and two others injured when a speeding truck rammed into the two auto-rickshaws on the national highway-2 (popularly known as Grand Trunk (GT) Road) near Amas town in Bihar’s Gaya district on Monday, a police officer told TOI here.",https://timesofindia.indiatimes.com/city/patna/bihar-nine-killed-two-injured-in-road-accident-in-gaya/articleshow/76393393.cms
69,Bihar: 5% fall in Road accidents in second half of 2019,"There was 5% decline in the number of accidents and 6% fall in accident deaths in the state in the second half of 2019, said state transport secretary Sanjay Kumar Agarwal on the concluding day of the Road Safety Week on Friday.",https://timesofindia.indiatimes.com/city/patna/55-fall-in-road-accidents-in-second-half-of-2019/articleshow/73337591.cms
70,Aurangabad: Road accident fatalities reduce by 65%,"In a meeting through video conference on Monday, Aurangabad Municipal Corporation (AMC) administrator and municipal commissioner Astik Kumar Pandey said that Road accident fatalities have reduced by 65 % over the last four months",https://timesofindia.indiatimes.com/city/aurangabad/road-accident-fatalities-reduce-by-65/articleshow/76142857.cms
71,"Bihar: Couple, children travelling to Saharsa from Delhi killed in Road accident",,https://timesofindia.indiatimes.com/city/patna/bihar-couple-children-travelling-to-saharsa-from-delhi-killed-in-road-accident/articleshow/81725649.cms
72,7 killed in Road accidents in Bihar,"Seven people, including three of a family, were killed in Road accidents in Rohtas and Darbhanga districts on Sunday.",https://timesofindia.indiatimes.com/city/patna/7-killed-in-road-accidents/articleshow/74272893.cms
73,Poll duty-bound SSB jawan dies in Road accident in Bihar,"The incident took place near Dumra Chowk in Kotwa police station area on Monday night when 34-year-old Sashastra Seema Bal jawan Shailesh Kumar Singh was going to a polling booth in Kalyanpur constituency in East Champaran district on his motorcycle, a police officer said.",https://timesofindia.indiatimes.com/city/patna/poll-duty-bound-ssb-jawan-dies-in-road-accident-in-bihar/articleshow/79019331.cms
74,Father-son duo among four die in two Road accidents in Bihar,,https://timesofindia.indiatimes.com/city/patna/father-son-duo-among-four-die-in-two-road-accidents-in-bihar/articleshow/81248732.cms
75,Two die in Nalanda Road accidents,"At least two persons, including the son of a mukhiya, were killed and another sustained critical injuries in two separate Road accidents in Nalanda district on Monday.",https://timesofindia.indiatimes.com/city/patna/2-die-in-nalanda-road-accidents/articleshow/74290041.cms
76,Bihar: Six killed in Road accidents in Arwal and Nalanda,"At least six people were killed in two separate Road accidents in Nalanda and Arwal district in the last 24 hours on Monday. While five people died in Arwal district late on Sunday night, a 65-year-old man was crushed to death by a speeding truck under Chandi police station in Nalanda district on Monday morning.",https://timesofindia.indiatimes.com/city/patna/bihar-six-killed-in-road-accidents-in-arwal-and-nalanda/articleshow/76940289.cms
77,"Three killed, six injured in a Road accident in Bhojpur","Three persons including two women were killed and six others injured when the SUV in which they were travelling overturned in Bihar's Bhojpur district on Tuesday, police said.",https://timesofindia.indiatimes.com/city/patna/three-killed-six-injured-in-a-road-accident-in-bhojpur/articleshow/72026082.cms
78,"2 killed, 1 hurt in Road accident",,https://timesofindia.indiatimes.com/city/aurangabad/2-killed-1-hurt-in-road-accident/articleshow/74532030.cms
79,Five killed in two Road accidents in Supaul,At least five people were killed and two others received serious injuries in two Road accidents in Supaul district on Tuesday morning.,https://timesofindia.indiatimes.com/city/patna/5-killed-in-two-road-accidents-in-supaul/articleshow/74463571.cms
80,Nine migrant labourers killed in Road accident in Bihar,"Bhagalpur, May 19 () Nine migrant labourers were killed on Tuesday when the truck carrying them overturned in an attempt to avert a head-on collision with a bus in Bihar's Bhagalpur district, police said.",https://timesofindia.indiatimes.com/city/patna/nine-migrant-labourers-killed-in-road-accident-in-bihar/articleshow/75821575.cms
81,Eight migrants from Bihar killed in Road accidents,"As many as eight Bihar migrant workers were killed and 31 others injured, nine of them critically, while they were on their way home in two separate Road accidents in the past 24 hours.",https://timesofindia.indiatimes.com/city/patna/8-migrants-from-state-killed-in-road-accidents/articleshow/75744903.cms
82,Patna: Intermediate examinee dies in Road accident,,https://timesofindia.indiatimes.com/city/patna/intermediate-examinee-dies-in-road-accident/articleshow/74087856.cms
83,AIIMS-Patna felicitates Road accident survivors,The All India Institute of Medical Sciences-Patna (AIIMS-P) on Wednesday felicitated 10 persons who lost their limbs after undergoing amputation during treatment there after Road accidents. It was a part of the road safety week being organised by the institute.,https://timesofindia.indiatimes.com/city/patna/aiims-p-felicitates-road-accident-survivors/articleshow/73279619.cms
84,Road accident fatalities up 14.8% in Bihar,"The state has witnessed 14.8% increase in Road accident deaths in the first six months (January to June) of this year when compared to the same period last year. The cases of Road accidents and injuries have also increased by 10.3% and 9.1%, respectively.",https://timesofindia.indiatimes.com/city/patna/road-accident-fatalities-up-14-8-in-state/articleshow/71558898.cms
85,"Seven killed, 15 injured in Road accidents in Bihar",,https://timesofindia.indiatimes.com/city/patna/seven-killed-15-injured-in-road-accidents-in-bihar/articleshow/74268155.cms
86,Eight killed in two separate Road accidents in Aurangabad,"In Aurangabad district, eight people were killed and 12 were seriously injured in two separate Road accidents during the last 24 hours.",https://timesofindia.indiatimes.com/city/patna/8-killed-in-two-separate-road-accidents-in-aurangabad/articleshow/74197262.cms
87,6.33 per cent increase in Road accident deaths in Bihar,"The number of deaths in Road accidents in Bihar increased by 6.33% last year compared to 2018, according to the latest data of state transport department.",https://timesofindia.indiatimes.com/city/patna/6-33-increase-in-road-accident-deaths-in-state/articleshow/73218327.cms
88,Bihar: Three buses set on fire after father and son killed in Road accident,"Angry villagers set three private buses on fire on Muzaffarpur-Hajipur NH-22 after a man and his son were killed in a Road accident in Bihar's Vaishali district on Tuesday, police said.",https://timesofindia.indiatimes.com/city/patna/bihar-three-buses-set-on-fire-after-father-and-son-killed-in-road-accident/articleshow/72957471.cms
89,Four killed in bus-tempo collision in Maharashtra,"At least four people lost their lives and around 15 others were injured on Tuesday when a bus collided with a tempo in adjoining Beed district in central Maharashtra, police said.",https://timesofindia.indiatimes.com/city/aurangabad/four-killed-in-bus-tempo-collision-in-maharashtra/articleshow/72957283.cms
90,"Maharashtra: 8 killed, 8 injured in truck-taxi collision","Eight persons were killed when a truck collided with a taxi in Jalgaon district of Maharashtra on Monday, police said. The accident took place near Pimpalkotha village in Erandol tehsil on the Mumbai-Nagpur highway, police said.",https://timesofindia.indiatimes.com/city/aurangabad/maharashtra-8-killed-8-injured-in-truck-taxi-collision/articleshow/72941455.cms
91,"Two killed, 11 injured in separate accidents",Two persons were killed and 11 sustained injuries in separate Road accidents in the state in last 24 hours.,https://timesofindia.indiatimes.com/city/patna/two-killed-11-injured-in-separate-accidents/articleshow/72480135.cms
92,Bihar: Sub-inspector dies in Aurangabad accident,A police sub-inspector Amit Kishor Rajak died in a Road accident near Khaira village under Mufassil police station area in Aurangabad district on Sunday night. Three other policemen also received serious injuries in the accident.,https://timesofindia.indiatimes.com/city/patna/sub-inspector-dies-in-aurangabad-accident/articleshow/72446010.cms
93,Patna girl among 4 die in two Road accidents,,https://timesofindia.indiatimes.com/city/patna/patna-girl-among-4-die-in-two-road-accidents/articleshow/73145130.cms
94,Gaya admn concerned over Road accident deaths in district,,https://timesofindia.indiatimes.com/city/patna/gaya-admn-concerned-over-road-accident-deaths-in-district/articleshow/72373020.cms
95,Road accident claims two lives in Patna,"Two people, including a retired Patna University teacher Dr Lal Narayan Sharma (78), died after a car rammed into a roundabout at Rajendra Nagar under Kankerbagh police station area in the city on Tuesday.",https://timesofindia.indiatimes.com/city/patna/road-accident-claims-2-lives/articleshow/69655399.cms
